{"apiVersion":"tplaiter.dev/state-ledger-report/v1","entries":[],"planSHA256":"sha256:aaaaaaaaaaaaaaaaaaaaaaaaaaaaaaaaaaaaaaaaaaaaaaaaaaaaaaaaaaaaaaaa","projectID":"fixture","receipt":{"authorityId":"platform","backend":"fixture","backendProtected":true,"checkpointDigest":"sha256:cccccccccccccccccccccccccccccccccccccccccccccccccccccccccccccccc","envelopePayloadSHA256":"sha256:bbbbbbbbbbbbbbbbbbbbbbbbbbbbbbbbbbbbbbbbbbbbbbbbbbbbbbbbbbbbbbbb","highestAcceptedSequence":1,"journalDigest":"sha256:dddddddddddddddddddddddddddddddddddddddddddddddddddddddddddddddd","journalStatus":"complete","protection":"test","revocationEpoch":0,"treeSize":1},"reportSHA256":"sha256:2be1b1d23234ce279cdb3976a6494ff0b9478ef3f74512f73f0a1131b8e49550","result":"planned","testOutcomes":[]}
